Text,rule_clean,tfidf_clean,deep_clean
Àtẹ̀jáde ìtúmọ̀ 22 Ṣẹẹrẹ 2019 21 : 45 GMT,àtẹ jáde ìtúmọ 22 ṣẹẹrẹ 2019 21 45 gmt,àtẹ jáde ìtúmọ ṣẹẹrẹ gmt,▁à t ẹ ▁já de ▁ ì tú m ọ ▁22 ▁ ṣ ẹ ẹ r ẹ ▁2019 ▁21 ▁45 ▁g m t
Mínísítà tún tẹ̀síwájú pé ètò kónílé - gbélé tó ń lọ lọ́wọ́ yìí wà nípa bí ètò ìlànà tí gbogbo orílẹ̀ àgbáyé làà sílẹ̀ .,mínísítà tún tẹ síwájú pé ètò kónílé - gbélé tó ń lọ lọ wọ yìí wà nípa bí ètò ìlànà tí gbogbo orílẹ àgbáyé làà sílẹ,mínísítà tún tẹ síwájú pé ètò kónílé gbélé tó ń lọ lọ wọ yìí wà nípa bí ètò ìlànà tí gbogbo orílẹ àgbáyé làà sílẹ,▁mí ní sít à ▁tú n ▁t ẹ ▁sí w ájú ▁pé ▁è t ò ▁kó ní lé ▁- ▁ gb élé ▁tó ▁ ń ▁l ọ ▁l ọ ▁w ọ ▁y ì í ▁w à ▁ní pa ▁bí ▁è t ò ▁ ì là n à ▁tí ▁g bog bo ▁or íl ẹ ▁à g bá y é ▁là à ▁síl ẹ
Chemi Lhamo ti jẹ́ ajàjàǹgbara akẹ́kọ̀ọ́ fún ọdún mélòó kan .,chemi lhamo ti jẹ ajàjàǹgbara akẹ kọ ọ fún ọdún mélòó kan,chemi lhamo ti jẹ akẹ kọ ọ fún ọdún mélòó kan,▁che mi ▁l ham o ▁ti ▁j ẹ ▁aj à j à ǹ g bara ▁ak ẹ ▁k ọ ▁ ọ ▁fú n ▁ ọ dú n ▁mé l ò ó ▁kan
Àwòrán láti BBC # SexForGrades .,àwòrán láti bbc sexforgrades,àwòrán láti bbc sexforgrades,▁à w ò rán ▁lát i ▁b bc ▁sex for grade s
"A ó se àdínkù sí ètò kónílé – gbélé ní ọjọ́ kẹrin , osù karùn ún , ọdun 2020 yii .",a ó se àdínkù sí ètò kónílé gbélé ní ọjọ kẹrin osù karùn ún ọdun 2020 yii,a ó se àdínkù sí ètò kónílé gbélé ní ọjọ kẹrin osù karùn ún ọdun yii,▁a ▁ó ▁se ▁à dí nk ù ▁sí ▁è t ò ▁kó ní lé ▁ gb élé ▁ní ▁ ọ j ọ ▁k ẹ rin ▁os ù ▁kar ù n ▁ún ▁ ọ dun ▁2020 ▁yi i
Àjùsẹ́wọ̀n fún yẹ̀yẹ́,àjùsẹ wọ n fún yẹ yẹ,wọ n fún yẹ yẹ,▁à j ù s ẹ ▁w ọ ▁n ▁fú n ▁y ẹ ▁y ẹ
"Ó ti tó ìgbà díẹ̀ kan tí ó ti ń ṣiṣẹ́ pẹ̀lú ìyàwó rẹ̀ àti olùdásọ́rọ̀ òṣèlú tí ó gbajúmọ̀ n nì , Naky Soto , tí wọn sì ń ṣe ìgbéjáde àwọn fídíò àti ètò Ìgbóhùnsáfẹ́fẹ́ lórí ayélujára èyí tí ó dá lórí ìṣèlú àti ẹ̀tọ́ ọmọ ènìyàn ní Venezuela .",ó ti tó ìgbà díẹ kan tí ó ti ń ṣiṣẹ pẹ lú ìyàwó rẹ àti olùdásọ rọ òṣèlú tí ó gbajúmọ n nì naky soto tí wọn sì ń ṣe ìgbéjáde àwọn fídíò àti ètò ìgbóhùnsáfẹ fẹ lórí ayélujára èyí tí ó dá lórí ìṣèlú àti ẹ tọ ọmọ ènìyàn ní venezuela,ó ti tó ìgbà díẹ kan tí ó ti ń ṣiṣẹ pẹ lú ìyàwó rẹ àti rọ òṣèlú tí ó gbajúmọ n nì naky soto tí wọn sì ń ṣe ìgbéjáde àwọn fídíò àti ètò ìgbóhùnsáfẹ fẹ lórí ayélujára èyí tí ó dá lórí ìṣèlú àti ẹ tọ ọmọ ènìyàn ní venezuela,▁ó ▁ti ▁tó ▁ ì gb à ▁dí ẹ ▁kan ▁tí ▁ó ▁ti ▁ ń ▁ ṣ i ṣ ẹ ▁p ẹ ▁lú ▁ ì y à w ó ▁r ẹ ▁à ti ▁ol ù dá s ọ ▁r ọ ▁ ò ṣ è lú ▁tí ▁ó ▁g ba jú m ọ ▁n ▁n ì ▁na ky ▁so to ▁tí ▁w ọ n ▁sì ▁ ń ▁ ṣ e ▁ ì g bé já de ▁à w ọ n ▁fí dí ò ▁à ti ▁è t ò ▁ ì g bó hù n sá f ẹ ▁f ẹ ▁ló rí ▁ay é lu jára ▁è y í ▁tí ▁ó ▁dá ▁ló rí ▁ ì ṣ è lú ▁à ti ▁ ẹ ▁t ọ ▁ ọ m ọ ▁è n ì y àn ▁ní ▁venez u ela
George lé orin rẹ̀ tuntun Montano náà sọ ọ̀rọ̀ ìkẹyìn :,george lé orin rẹ tuntun montano náà sọ ọ rọ ìkẹyìn,george lé orin rẹ tuntun montano náà sọ ọ rọ ìkẹyìn,▁geo rge ▁lé ▁or in ▁r ẹ ▁tuntu n ▁monta no ▁ná à ▁s ọ ▁ ọ ▁r ọ ▁ ì k ẹ y ì n
Kí ló dé tí Ilẹ̀ - Adúláwọ̀ kò ní ẹ̀tọ́ láti ṣẹ̀ gẹ́gẹ́ bí ẹ̀ka tí ó ṣe pàtàkì nínú òmìnira ọ̀rọ̀ sísọ ?,kí ló dé tí ilẹ - adúláwọ kò ní ẹ tọ láti ṣẹ gẹ gẹ bí ẹ ka tí ó ṣe pàtàkì nínú òmìnira ọ rọ sísọ ?,kí ló dé tí ilẹ adúláwọ kò ní ẹ tọ láti ṣẹ gẹ gẹ bí ẹ ka tí ó ṣe pàtàkì nínú òmìnira ọ rọ sísọ,▁kí ▁ló ▁dé ▁tí ▁il ẹ ▁- ▁a dú lá w ọ ▁k ò ▁ní ▁ ẹ ▁t ọ ▁lát i ▁ ṣ ẹ ▁g ẹ ▁g ẹ ▁bí ▁ ẹ ▁ka ▁tí ▁ó ▁ ṣ e ▁pà tà k ì ▁ní nú ▁ ò m ì ni ra ▁ ọ ▁r ọ ▁sí s ọ ▁?
com / CIZtojz5UR .,com ciztojz5ur,com,▁com ▁ci z toj z 5 ur
Ó jẹ́ ọ̀kan lára olùdásílẹ̀ Ìpolongo # BringBackOurGirls ( BBOG ) .,ó jẹ ọ kan lára olùdásílẹ ìpolongo bringbackourgirls bbog,ó jẹ ọ kan lára olùdásílẹ ìpolongo bringbackourgirls bbog,▁ó ▁j ẹ ▁ ọ ▁kan ▁l ára ▁ol ù dá s íl ẹ ▁ ì pol ongo ▁bring back our girl s ▁b bog
"ìtẹ̀síwájú orílè - èdè náà ya pẹ́rẹpẹ̀rẹ . """"""""",ìtẹ síwájú orílè - èdè náà ya pẹ rẹpẹ rẹ,ìtẹ síwájú orílè èdè náà ya pẹ rẹpẹ rẹ,▁ ì t ẹ ▁sí w ájú ▁or í lè ▁- ▁è d è ▁ná à ▁ya ▁p ẹ ▁r ẹ p ẹ ▁r ẹ
( Àwòrán ní ìpamọ́ ) # Amoulanfe # Kibaro # Guinee pic . twitter . com / xk6xax8DT0,àwòrán ní ìpamọ amoulanfe kibaro guinee pic twitter com xk6xax8dt0,àwòrán ní ìpamọ amoulanfe pic twitter com,▁à w ò rán ▁ní ▁ ì pam ọ ▁amo ulan fe ▁ki bar o ▁gu ine e ▁pic ▁twitter ▁com ▁x k 6 xa x 8 dt 0
Ìjàm̀bá Àwọn Ológun Mauritania 28 tí wọ́n pa ní ọjọ́ Òmìnira tí a kò sọ,ìjàm bá àwọn ológun mauritania 28 tí wọ n pa ní ọjọ òmìnira tí a kò sọ,ìjàm bá àwọn ológun mauritania tí wọ n pa ní ọjọ òmìnira tí a kò sọ,▁ ì j à m ▁bá ▁à w ọ n ▁ ológ un ▁ma uri tania ▁28 ▁tí ▁w ọ ▁n ▁pa ▁ní ▁ ọ j ọ ▁ ò m ì ni ra ▁tí ▁a ▁k ò ▁s ọ
"Ìpolongo náà kún fún àwọn ọ̀kan - ò - jọ̀kan àǹfààní ẹ̀bùn ọ̀fẹ́ láti GB 1 sí GB 5 , tí owóo rẹ̀ jẹ́ 25 sí 100 meticals ( 0 . 37 sí 1 . 50 owó US ) .",ìpolongo náà kún fún àwọn ọ kan - ò - jọ kan àǹfààní ẹ bùn ọ fẹ láti gb 1 sí gb 5 tí owóo rẹ jẹ 25 sí 100 meticals 0 37 sí 1 50 owó us,ìpolongo náà kún fún àwọn ọ kan ò jọ kan àǹfààní ẹ bùn ọ fẹ láti gb sí gb tí owóo rẹ jẹ sí meticals sí owó us,▁ ì pol ongo ▁ná à ▁kú n ▁fú n ▁à w ọ n ▁ ọ ▁kan ▁- ▁ ò ▁- ▁j ọ ▁kan ▁à ǹ f à à ní ▁ ẹ ▁bù n ▁ ọ ▁f ẹ ▁lát i ▁ gb ▁1 ▁sí ▁ gb ▁5 ▁tí ▁ ow ó o ▁r ẹ ▁j ẹ ▁25 ▁sí ▁100 ▁met ical s ▁0 ▁37 ▁sí ▁1 ▁50 ▁ ow ó ▁us
Ohun tí El - Rufai sọ yìí ò mú kí ipò igbákejì ààrẹ tọ́ fún Obi .,ohun tí el - rufai sọ yìí ò mú kí ipò igbákejì ààrẹ tọ fún obi,ohun tí el rufai sọ yìí ò mú kí ipò igbákejì ààrẹ tọ fún obi,▁o hun ▁tí ▁el ▁- ▁ ruf ai ▁s ọ ▁y ì í ▁ ò ▁mú ▁kí ▁i p ò ▁ ig bá kej ì ▁à à r ẹ ▁t ọ ▁fú n ▁obi
"Lẹ́yìn ìwádìí , àwọn ọlọ́pàá ṣe àrídájú wípé ọmọ - ọ̀dọ̀ kan láti ilẹ̀ òkèèrè tí ó ń bẹ̀rù wípé ọ̀gá òun yóò lé òun ni ẹnu iṣẹ́ bí ó bá mọ̀ wípé òun ní oyún ni ìyáa rẹ̀ .",lẹ yìn ìwádìí àwọn ọlọ pàá ṣe àrídájú wípé ọmọ - ọ dọ kan láti ilẹ òkèèrè tí ó ń bẹ rù wípé ọ gá òun yóò lé òun ni ẹnu iṣẹ bí ó bá mọ wípé òun ní oyún ni ìyáa rẹ,lẹ yìn ìwádìí àwọn ọlọ pàá ṣe àrídájú wípé ọmọ ọ dọ kan láti ilẹ òkèèrè tí ó ń bẹ rù wípé ọ gá òun yóò lé òun ni ẹnu iṣẹ bí ó bá mọ wípé òun ní oyún ni rẹ,▁l ẹ ▁y ì n ▁ ì w ád ì í ▁à w ọ n ▁ ọ l ọ ▁pà á ▁ ṣ e ▁à rí d ájú ▁w í pé ▁ ọ m ọ ▁- ▁ ọ ▁d ọ ▁kan ▁lát i ▁il ẹ ▁ ò k è è rè ▁tí ▁ó ▁ ń ▁b ẹ ▁r ù ▁w í pé ▁ ọ ▁gá ▁ ò un ▁y ó ò ▁lé ▁ ò un ▁ni ▁ ẹ nu ▁i ṣ ẹ ▁bí ▁ó ▁bá ▁m ọ ▁w í pé ▁ ò un ▁ní ▁oy ún ▁ni ▁ ì y á a ▁r ẹ
Àwòrán 3 : Ọ̀rọ̀ ìkórìíra ẹ̀yà tẹ̀gbintẹ̀gbin,àwòrán 3 ọ rọ ìkórìíra ẹ yà tẹ gbintẹ gbin,àwòrán ọ rọ ìkórìíra ẹ yà tẹ gbintẹ gbin,▁à w ò rán ▁3 ▁ ọ ▁r ọ ▁ ì kór ì í ra ▁ ẹ ▁y à ▁t ẹ ▁g bin t ẹ ▁g bin
Ẹyẹ náà ti ń dínkù látàrí ìgbẹ́ pípa fún iṣẹ́ ọ̀gbìn àti ìtẹ́lọ ìgbèríko di ìgboro .,ẹyẹ náà ti ń dínkù látàrí ìgbẹ pípa fún iṣẹ ọ gbìn àti ìtẹ lọ ìgbèríko di ìgboro,ẹyẹ náà ti ń dínkù látàrí ìgbẹ pípa fún iṣẹ ọ àti ìtẹ lọ ìgbèríko di ìgboro,▁ ẹ y ẹ ▁ná à ▁ti ▁ ń ▁dí nk ù ▁lát à rí ▁ ì gb ẹ ▁pí pa ▁fú n ▁i ṣ ẹ ▁ ọ ▁ gb ì n ▁à ti ▁ ì t ẹ ▁l ọ ▁ ì gb è rí ko ▁di ▁ ì g boro
"Èyí [ ni ọ̀nà kan ] fún ìpèsí àkíyèsí ìjọba João Lourenço , wípé àfilé ìdíyelé kò yẹ nírú àsìkò yìí , nítorí owó náà ti ṣe gegere ju fún àwọn ọmọ ìlú .",èyí ni ọ nà kan fún ìpèsí àkíyèsí ìjọba joão lourenço wípé àfilé ìdíyelé kò yẹ nírú àsìkò yìí nítorí owó náà ti ṣe gegere ju fún àwọn ọmọ ìlú,èyí ni ọ nà kan fún ìpèsí àkíyèsí ìjọba joão lourenço wípé àfilé ìdíyelé kò yẹ nírú àsìkò yìí nítorí owó náà ti ṣe gegere ju fún àwọn ọmọ ìlú,▁è y í ▁ni ▁ ọ ▁n à ▁kan ▁fú n ▁ ì p ès í ▁à k í y ès í ▁ ì j ọ ba ▁jo ão ▁lo uren ço ▁w í pé ▁à fi lé ▁ ì dí ye lé ▁k ò ▁y ẹ ▁ní rú ▁às ì k ò ▁y ì í ▁ní tor í ▁ ow ó ▁ná à ▁ti ▁ ṣ e ▁ge gere ▁ju ▁fú n ▁à w ọ n ▁ ọ m ọ ▁ ì lú
